{
    "role": "Coordinator",
    "id": "CVE-2014-0751",
    "version": "2.0",
    "computed": "SSVCv2/E:A/V:S/T:T/P:M/B:A/M:M/D:A/2021-09-29T15:29:44Z/",
    "timestamp": "2021-09-29T15:29:44Z",
    "options": [
	{
	    "Exploitation": "active"
	},
	{
	    "Virulence": "slow"
	},
	{
	    "Technical Impact": "total"
	},
	{
	    "Mission Prevalence": "Minimal"
	},
	{
	    "Public Well-being Impact": "Material"
	},
	{
	    "Mission & Well-being": "medium"
	}
    ],
    "$schema": "https://democert.org/ssvc/SSVC_Computed_v2.02.schema.json",
    "decision_tree_url": "https://democert.org/ssvc/CISA-Coordinator-v2.02.json"
}
